{
  "$schema": "https://json-schema.org/draft/2020-12/schema",
  "$id": "assessment-engine/source_snapshot.schema.json",
  "type": "object",
  "additionalProperties": false,
  "required": ["snapshot_id", "startup_id", "scope_id", "inventory"],
  "properties": {
    "snapshot_id": {"type": "string", "minLength": 1},
    "startup_id": {"type": "string", "minLength": 1},
    "scope_id": {"type": "string", "minLength": 1},
    "inventory": {
      "type": "array",
      "items": {
        "type": "object",
        "additionalProperties": false,
        "required": ["document_id", "sha256"],
        "properties": {
          "document_id": {"type": "string", "minLength": 1},
          "sha256": {"type": "string", "pattern": "^[0-9a-f]{64}$"}
        }
      }
    }
  }
}
